section,name,description
Linux Commands  I,iptables-restore,Used to restore IP tables from data specified in the input or a file.
Linux Commands  I,iptables-save,Used to dump IP table contents to standard output.
Linux Commands  I,isodump,A utility that shows the content iso9660 images to verify the integrity of directory contents.
Linux Commands  I,isoinfo,A utility to perform directory like listings of iso9660 images.
Linux Commands  I,isosize,Show the length of an iso9660 filesystem contained in a specified file.
Linux Commands  I,isovfy,Verifies the integrity of an iso9660 image.
Linux Commands  I,ispell,A CLI-based spell-check utility.
Linux Commands  J,jobs,Show the list of active jobs and their status.
Linux Commands  J,join,"For each pair of input lines, join them using a command field and display on standard output."
Linux Commands  K,kbd_mode,"Set a keyboard mode. Without arguments, shows the current keyboard mode."
Linux Commands  K,kbdrate,Reset keyboard repeat rate and delay time.
Linux Commands  K,kill,Send a kill (termination) signal to one more processes.
Linux Commands  K,killall,Kills a process(es) running a specified command.
Linux Commands  K,killall5,A SystemV killall command. Kills all the processes excluding the ones which it depends on.
Linux Commands  K,klogd,"Control and prioritize the kernel messages to be displayed on the console, and log them through syslogd."
Linux Commands  K,kudzu,Used to detect new and enhanced hardware by comparing it with existing database. Only for RHEL and derivates.
Linux Commands  L,last,Shows a list of recent logins on the system by fetching data from /var/log/wtmp file.
Linux Commands  L,lastb,Shows the list of bad login attempts by fetching data from /var/log/btmp file.
Linux Commands  L,lastlog,Displays information about the most recent login of all users or a specified user.
Linux Commands  L,ld,"The Unix linker, it combines archives and object files. It then puts them into one output file, resolving external references."
Linux Commands  L,ldconfig,Configure dynamic linker run-time bindings.
Linux Commands  L,ldd,Shows shared object dependencies.
Linux Commands  L,less,Displays contents of a file one page at a time. It’s advanced than more command.
Linux Commands  L,lesskey,Used to specify key bindings for less command.
Linux Commands  L,let,Used to perform integer artithmetic on shell variables.
Linux Commands  L,lftp,An FTP utility with extra features.
Linux Commands  L,lftpget,"Uses lftop to retrieve HTTP, FTP, and other protocol URLs supported by lftp."
Linux Commands  L,link,Create links between two files. Similar to ln command.
Linux Commands  L,ln,Create links between files. Links can be hard (two names for the same file) or soft (a shortcut of the first file).
Linux Commands  L,loadkeys,Load keyboard translation tables.
Linux Commands  L,local,Used to create function variables.
Linux Commands  L,locale,Shows information about current or all locales.
Linux Commands  L,locate,Used to find files by their name.
Linux Commands  L,lockfile,Create semaphore file(s) which can be used to limit access to a file.
Linux Commands  L,logger,Make entries in the system log.
Linux Commands  L,login,Create a new session on the system.
Linux Commands  L,logname,Shows the login name of the current user.
Linux Commands  L,logout,Performs the logout operation by making changes to the utmp and wtmp files.
Linux Commands  L,logrotate,"Used for automatic rotation, compression, removal, and mailing of system log files."
Linux Commands  L,look,Shows any lines in a file containing a given string in the beginning.
Linux Commands  L,losetup,Set up and control loop devices.
Linux Commands  L,lpadmin,Used to configure printer and class queues provided by CUPS (Common UNIX Printing System).
Linux Commands  L,lpc,"Line printer control program, it provides limited control over CUPS printer and class queues."
Linux Commands  L,lpinfo,Shows the list of avaiable devices and drivers known to the CUPS server.
Linux Commands  L,lpmove,Move on or more printing jobs to a new destination.
Linux Commands  L,lpq,Shows current print queue status for a specified printer.
Linux Commands  L,lpr,Used to submit files for printing.
Linux Commands  L,lprint,Used to print a file.
Linux Commands  L,lprintd,Used to abort a print job.
Linux Commands  L,lprintq,List the print queue.
Linux Commands  L,lprm,Cancel print jobs.
Linux Commands  L,lpstat,"Displays status information about current classes, jobs, and printers."
Linux Commands  L,ls,Shows the list of files in the current directory.
Linux Commands  L,lsattr,Shows file attributes on a Linux ext2 file system.
Linux Commands  L,lsblk,Lists information about all available or the specified block devices.
Linux Commands  L,lsmod,Show the status of modules in the Linux kernel.
Linux Commands  L,lsof,List open files.
Linux Commands  L,lspci,List all PCI devices.
Linux Commands  L,lsusb,List USB devices.
Linux Commands  M,m4,Macro processor.
Linux Commands  M,mail,"Utility to compose, receive, send, forward, and reply to emails."
Linux Commands  M,mailq,Shows to list all emails queued for delivery (sendmail queue).
Linux Commands  M,mailstats,Shows current mail statistics.
Linux Commands  M,mailto,Used to send mail with multimedia content in MIME format.
Linux Commands  M,make,"Utility to maintain groups of programs, recompile them if needed."
Linux Commands  M,makedbm,Creates an NIS (Network Information Services) database map.
Linux Commands  M,makemap,Creates database maps used by the keyed map lookups in sendmail.
Linux Commands  M,man,Shows manual pages for Linux commands.
Linux Commands  M,manpath,Determine search path for manual pages.
Linux Commands  M,mattrib,Used to change MS-DOS file attribute flags.
Linux Commands  M,mbadblocks,Checks MD-DOS filesystems for bad blocks.
Linux Commands  M,mcat,Dump raw disk image.
Linux Commands  M,mcd,Used to change MS-DOS directory.
Linux Commands  M,mcopy,Used to copy MS-DOS files from or to Unix.
Linux Commands  M,md5sum,Used to check MD5 checksum for a file.
Linux Commands  M,"mdel, mdeltree",Used to delete MS-DOS file. mdeltree recursively deletes MS-DOS directory and its contents.
Linux Commands  M,mdir,Used to display an MS-DOS directory.
Linux Commands  M,mdu,Used to display the amount of space occupied by an MS-DOS directory.
Linux Commands  M,merge,Three-way file merge. Includes all changes from file2 and file3 to file1.
Linux Commands  M,mesg,Allow/disallow osends to sedn write messages to your terminal.
Linux Commands  M,metamail,For sending and showing rich text or multimedia email using MIME typing metadata.
Linux Commands  M,metasend,An interface for sending non-text mail.
Linux Commands  M,mformat,Used to add an MS-DOS filesystem to a low-level formatted floppy disk.
Linux Commands  M,mimencode,Translate to/from MIME multimedia mail encoding formats.
Linux Commands  M,minfo,Display parameters of an MS-DOS filesystem.
Linux Commands  M,mkdir,Used to create directories.
Linux Commands  M,mkdosfs,Used to create an MS-DOS filesystem under Linux.
Linux Commands  M,mke2fs,Used create an ext2/ext3/ext4 filesystem.
Linux Commands  M,mkfifo,Used to create named pipes (FIFOs) with the given names.
Linux Commands  M,mkfs,Used to build a Linux filesystem on a hard disk partition.
Linux Commands  M,mkfs.ext3,"Same as mke2fs, create an ext3 Linux filesystem."
Linux Commands  M,mkisofs,Used to create an ISO9660/JOLIET/HFS hybrid filesystem.
Linux Commands  M,mklost+found,Create a lost+found directory on a mounted ext2 filesystem.
Linux Commands  M,mkmanifest,Makes a list of file names and their DOS 8.3 equivalent.
Linux Commands  M,mknod,"Create a FIFO, block (buffered) special file, character (unbuffered) special file with the specified name."
Linux Commands  M,mkraid,Used to setup RAID device arrays.
Linux Commands  M,mkswap,Set up a Linux swap area.
Linux Commands  M,mktemp,Create a temporary file or directory.
Linux Commands  M,mlabel,Make an MD-DOS volume label.
Linux Commands  M,mmd,Make an MS-DOS subdirectory.
Linux Commands  M,mmount,Mount an MS-DOS disk.
Linux Commands  M,mmove,Move or rename an MS-DOS file or subdirectory.
Linux Commands  M,mmv,Mass move and rename files.
Linux Commands  M,modinfo,Show information about a Linux kernel module.
Linux Commands  M,modprobe,Add or remove modules from the Linux kernel.
Linux Commands  M,more,Display content of a file page-by-page.
Linux Commands  M,most,Browse or page through a text file.
Linux Commands  M,mount,Mount a filesystem.
Linux Commands  M,mountd,NFS mount daemon.
Linux Commands  M,mpartition,Partition an MS-DOS disk.
Linux Commands  M,mpg123,Command-line mp3 player.
Linux Commands  M,mpg321,Similar to mpg123.
Linux Commands  M,mrd,Remove an MS-DOS subdirectory.
Linux Commands  M,mren,Rename an existing MS-DOS file.
Linux Commands  M,mshowfat,Show FTA clusters allocated to a file.
Linux Commands  M,mt,Control magnetic tape drive operation.
Linux Commands  M,mtools,Utilities to access MS-DOS disks.
Linux Commands  M,mtoolstest,Tests and displays the mtools configuration files.
Linux Commands  M,mtr,A network diagnostic tool.
Linux Commands  M,mtype,Display contents of an MS-DOS file.
Linux Commands  M,mv,Move/rename files or directories.
Linux Commands  M,mzip,Change protection mode and eject disk on Zip/Jaz drive.
Linux Commands  N,named,Internet domain name server.
Linux Commands  N,namei,Follow a pathname until a terminal point is found.
Linux Commands  N,nameif,Name network interfaces based on MAC addresses.
Linux Commands  N,nc,Netcat utility. Arbitrary TCP and UDP connections and listens.
Linux Commands  N,netstat,Show network information.
Linux Commands  N,newaliases,Rebuilds mail alias database.
Linux Commands  N,newgrp,Log-in to a new group.
Linux Commands  N,newusers,Update/create new users in batch.
Linux Commands  N,nfsd,Special filesystem for controlling Linux NFS server.
Linux Commands  N,nfsstat,List NFS statistics.
Linux Commands  N,nice,Run a program with modified scheduling priority.
Linux Commands  N,nl,Show numbered line while displaying the contents of a file.
Linux Commands  N,nm,List symbols from object files.
Linux Commands  N,nohup,Run a command immune to hangups.
Linux Commands  N,notify-send,A program to send desktop notifications.
Linux Commands  N,nslookup,Used performs DNS queries. Read this article for more info.
Linux Commands  N,nsupdate,Dynamic DNS update utility.
Linux Commands  O,objcopy,Copy and translate object files.
Linux Commands  O,objdump,Display information from object files.
Linux Commands  O,od,Dump files in octal and other formats.
Linux Commands  O,op,"Operator access, allows system administrators to grant users access to certain root operations that require superuser privileges."
Linux Commands  O,open,Open a file using its default application.
Linux Commands  O,openvt,Start a program on a new virtual terminal (VT).
Linux Commands  P,passwd,Change user password.
Linux Commands  P,paste,"Merge lines of files. Write to standard output, TAB-separated lines consisting of sqentially correspnding lines from each file."
Linux Commands  P,patch,Apply a patchfile (containing differences listing by diff program) to an original file.
Linux Commands  P,pathchk,Check if file names are valid or portable.
Linux Commands  P,perl,Perl 5 language interpreter.
Linux Commands  P,pgrep,List process IDs matching the specified criteria among all the running processes.
Linux Commands  P,pidof,Find process ID of a running program.
Linux Commands  P,ping,Send ICMP ECHO_REQUEST to network hosts.
Linux Commands  P,pinky,Lightweight finger.
Linux Commands  P,pkill,Send kill signal to processes based on name and other attributes.
Linux Commands  P,pmap,Report memory map of a process.
Linux Commands  P,popd,Removes directory on the head of the directory stack and takes you to the new directory on the head.
Linux Commands  P,portmap,Converts RPC program numbers to IP port numbers.
Linux Commands  P,poweroff,Shuts down the machine.
Linux Commands  P,pppd,Point-to-point protocol daemon.
Linux Commands  P,pr,Convert (column or paginate) text files for printing.
Linux Commands  P,praliases,Prints the current system mail aliases.
Linux Commands  P,printcap,Printer capability database.
Linux Commands  P,printenv,Show values of all or specified environment variables.
Linux Commands  P,printf,Show arguments formatted according to a specified format.
Linux Commands  P,ps,Report a snapshot of the current processes.
Linux Commands  P,ptx,Produce a permuted index of file contents.
Linux Commands  P,pushd,Appends a given directory name to the head of the stack and then cd to the given directory.
Linux Commands  P,pv,Monitor progress of data through a pipe.
Linux Commands  P,pwck,Verify integrity of password files.
Linux Commands  P,pwconv,Creates shadow from passwd and an optionally existing shadow.
Linux Commands  P,pwd,Show current directory.
Linux Commands  P,python,
Linux Commands  Q,quota,"Shows disk usage, and space limits for a user or group. Without arguments, only shows user quotas."
Linux Commands  Q,quotacheck,Used to scan a file system for disk usage.
Linux Commands  Q,quotactl,Make changes to disk quotas.
Linux Commands  Q,quotaoff,Enable enforcement of filesystem quotas.
Linux Commands  Q,quotaon,Disable enforcement of filesystem quotas.
Linux Commands  Q,quotastats,Shows the report of quota system statistics gathered from the kernel.
Linux Commands  R,raidstart,Start/stop RAID devices.
Linux Commands  R,ram,RAM disk device used to access the RAM disk in raw mode.
Linux Commands  R,ramsize,Show usage information for the RAM disk.
Linux Commands  R,ranlib,Generate index to the contents of an archive and store it in the archive.
Linux Commands  R,rar,Create and manage RAR file in Linux.
Linux Commands  R,rarpd,Respond to Reverse Address Resoultion Protocol (RARP) requests.
Linux Commands  R,rcp,Remote copy command to copy files between remote computers.
Linux Commands  R,rdate,Set system date and time by fetching information from a remote machine.
Linux Commands  R,rdev,"Set or query RAM disk size, image root device, or video mode."
Linux Commands  R,rdist,"Remote file distribution client, maintains identical file copies over multiple hosts."
Linux Commands  R,rdistd,Start the rdist server.
Linux Commands  R,read,Read from a file descriptor.
Linux Commands  R,readarray,Read lines from a file into an array variable.
Linux Commands  R,readcd,Read/write compact disks.
Linux Commands  R,readelf,Shows information about ELF (Executable and Linkable fomrat) files.
Linux Commands  R,readlink,Display value of a symbolic link or canonical file name.
Linux Commands  R,readonly,Mark functions and variables as read-only.
Linux Commands  R,reboot,Restart the machine.
Linux Commands  R,reject,Accept/reject print jobs sent to a specified destination.
Linux Commands  R,remsync,Synchronize remote files over email.
Linux Commands  R,rename,Rename one or more files.
Linux Commands  R,renice,Change priority of active processes.
Linux Commands  R,repquota,Report disk usage and quotas for a specified filesystem.
Linux Commands  R,reset,Reinitialize the terminal.
Linux Commands  R,resize2fs,Used to resize ext2/ext3/ext4 file systems.
Linux Commands  R,restore,Restore files from a backup created using dump.
Linux Commands  R,return,Exit a shell function.
Linux Commands  R,rev,"Show contents of a file, reversing the order of characters in every line."
Linux Commands  R,rexec,Remote execution client for exec server.
Linux Commands  R,rexecd,Remote execution server.
Linux Commands  R,richtext,View “richtext” on an ACSII terminal.
Linux Commands  R,rlogin,Used to connect a local host system with a remote host.
Linux Commands  R,rlogind,"Acts as the server for rlogin. It facilitates remote login, and authentication based on privileged port numbers from trusted hosts."
Linux Commands  R,rm,Removes specified files and directories (not by default).
Linux Commands  R,rmail,Handle remote mail received via uucp.
Linux Commands  R,rmdir,Used to remove empty directories.
Linux Commands  R,rmmod,A program to remove modules from Linux kernel.
Linux Commands  R,rndc,Name server control utility. Send command to a BIND DNS server over a TCP connection.
Linux Commands  R,rootflags,Show/set flags for the kernel image.
Linux Commands  R,route,Show/change IP routing table.
Linux Commands  R,routed,"A daemon, invoked at boot time, to manage internet routing tables."
Linux Commands  R,rpcgen,An RPC protocol compiler. Parse a file written in the RPC language.
Linux Commands  R,rpcinfo,Shows RPC information. Makes an RPC call to an RPC server and reports the findings.
Linux Commands  R,rpm,A package manager for linux distributions. Originally developed for RedHat Linux.
Linux Commands  R,rsh,Remote shell. Connects to a specified host and executes commands.
Linux Commands  R,rshd,A daemon that acts as a server for rsh and rcp commands.
Linux Commands  R,rsync,A versitile to for copying files remotely and locally.
Linux Commands  R,runlevel,Shows previous and current SysV runlevel.
Linux Commands  R,rup,Remote status display. Shows current system status for all or specified hosts on the local network.
Linux Commands  R,ruptime,Shows uptime and login details of the machines on the local network.
Linux Commands  R,rusers,Shows the list of the users logged-in to the host or on all machines on the local network.
Linux Commands  R,rusersd,The rsuerd daemon acts as a server that responds to the queries from rsuers command.
Linux Commands  R,rwall,Sends messages to all users on the local network.
Linux Commands  R,rwho,Reports who is logged-in to the hosts on the local network.
Linux Commands  R,rwhod,Acts as a server for rwho and ruptime commands.
Linux Commands  S,sane-find-scanner,Find SCSI and USB scanner and determine their device files.
Linux Commands  S,scanadf,Retrieve multiple images from a scanner equipped with an automatic document feeder (ADF).
Linux Commands  S,scanimage,Read images from image aquistion devices (scanner or camera) and display on standard output in PNM (Portable aNyMap) format.
Linux Commands  S,scp,Copy files between hosts on a network securely using SSH.
Linux Commands  S,screen,A window manager that enables multiple pseudo-terminals with the help of ANSI/VT100 terminal emulation.
Linux Commands  S,script,Used to make a typescript of everything displayed on the screen during a terminal session.
Linux Commands  S,sdiff,Shows two files side-by-side and highlights the differences.
Linux Commands  S,sed,Stream editor for filtering and transforming text (from a file or a pipe input).
Linux Commands  S,select,Synchronous I/O multiplexing.
Linux Commands  S,sendmail,It’s a mail router or an MTA (Mail Transfer Agent). sendmail support can send a mail to one or more recepients using necessary protocols.
Linux Commands  S,sensors,Shows the current readings of all sensor chips.
Linux Commands  S,seq,Displays an incremental sequence of numbers from first to last.
Linux Commands  S,set,Used to manipulate shell variables and functions.
Linux Commands  S,setfdprm,Sets floppy disk parameters as provided by the user.
Linux Commands  S,setkeycodes,Load kernel scancode-to-keycode mapping table entries.
Linux Commands  S,setleds,Show/change LED light settings of the keyboard.
Linux Commands  S,setmetamode,"Define keyboard meta key handling. Without arguments, shows current meta key mode."
Linux Commands  S,setquota,Set disk quotas for users and groups.
Linux Commands  S,setsid,Run a program in a new session.
Linux Commands  S,setterm,Set terminal attributes.
Linux Commands  S,sftp,Secure File Transfer program.
Linux Commands  S,sh,Command interpreter (shell) utility.
Linux Commands  S,sha1sum,Compute and check 160-bit SHA1 checksum to verify file integrity.
Linux Commands  S,shift,Shift positional parameters.
Linux Commands  S,shopt,Shell options.
Linux Commands  S,showkey,Examines codes sent by the keyboard displays them in printable form.
Linux Commands  S,showmount,Shows information about NFS server mount on the host.
Linux Commands  S,shred,"Overwrite a file to hide its content (optionally delete it), making it harder to recover it."
Linux Commands  S,shutdown,Power-off the machine.
Linux Commands  S,size,Lists section size and the total size of a specified file.
Linux Commands  S,skill,Send a signal to processes.
Linux Commands  S,slabtop,Show kernel slab cache information in real-time.
Linux Commands  S,slattach,Attack a network interface to a serial line.
Linux Commands  S,sleep,Suspend execution for a specified amount of time (in seconds).
Linux Commands  S,slocate,Display matches by searching filename databases. Takes ownership and file permission into consideration.
Linux Commands  S,snice,Reset priority for processes.
Linux Commands  S,sort,Sort lines of text files.
Linux Commands  S,source,Run commands from a specified file.
Linux Commands  S,split,Split a file into pieces of fixed size.
Linux Commands  S,ss,"Display socket statistics, similar to netstat."
Linux Commands  S,ssh,An SSH client for logging in to a remote machine. It provides encrypted communication between the hosts.
Linux Commands  S,ssh-add,Adds private key identities to the authentication agent.
Linux Commands  S,ssh-agent,It holds private keys used for public key authentication.
Linux Commands  S,ssh-keygen,"It generates, manages, converts authentication keys for ssh."
Linux Commands  S,ssh-keyscan,Gather ssh public keys.
Linux Commands  S,sshd,Server for the ssh program.
Linux Commands  S,stat,Display file or filesystem status.
Linux Commands  S,statd,"A daemon that listens for reboot notifications from other hosts, and manages the list of hosts to be notified when the local system reboots."
Linux Commands  S,strace,Trace system calls and signals.
Linux Commands  S,strfile,Create a random access file for storing strings.
Linux Commands  S,strings,Search a specified file and prints any printable strings with at least four characters and followed by an unprintable character.
Linux Commands  S,strip,Discard symbols from object files.
Linux Commands  S,stty,Change and print terminal line settings.
Linux Commands  S,su,Change user ID or become superuser.
Linux Commands  S,sudo,Execute a command as superuser.
Linux Commands  S,sum,Checksum and count the block in a file.
Linux Commands  S,suspend,Suspend the execution of the current shell.
Linux Commands  S,swapoff,Disable devices for paging and swapping.
Linux Commands  S,swapon,Enable devices for paging and swapping.
Linux Commands  S,symlink,Create a symbolic link to a file.
Linux Commands  S,sync,Synchronize cached writes to persistent storage.
Linux Commands  S,sysctl,Configure kernel parameters at runtime.
Linux Commands  S,sysklogd,Linux system logging utilities. Provides syslogd and klogd functionalities.
Linux Commands  S,syslogd,Read and log system messages to the system console and log files.
Linux Commands  T,tac,Concatenate and print files in reverse order. Opposite of cat command.
Linux Commands  T,tail,Show the last 10 lines of each specified file(s).
Linux Commands  T,tailf,Follow the growth of a log file. (Deprecated command)
Linux Commands  T,talk,A two-way screen-oriented communication utility that allows two user to exchange messages simulateneously.
Linux Commands  T,talkd,A remote user communication server for talk.
Linux Commands  T,tar,GNU version of the tar archiving utility. Used to store and extract multiple files from a single archive.
Linux Commands  T,taskset,Set/retrieve a process’s CPU affinity.
Linux Commands  T,tcpd,Access control utility for internet services.
Linux Commands  T,tcpdump,Dump traffic on network. Displays a description of the contents of packets on a network interface that match the boolean expression.
Linux Commands  T,tcpslice,Extract pieces of tcpdump files or merge them.
Linux Commands  T,tee,Read from standard input and write to standard output and files.
Linux Commands  T,telinit,Change SysV runlevel.
Linux Commands  T,telnet,Telnet protocol user interface. Used to interact with another host using telnet.
Linux Commands  T,telnetd,A server for the telnet protocol.
Linux Commands  T,test,Check file type and compare values.
Linux Commands  T,tftp,User interface to the internet TFTP (Trivial File Transfer Protocol).
Linux Commands  T,tftpd,TFTP server.
Linux Commands  T,time,Run programs and summarize system resource usage.
Linux Commands  T,timeout,Execute a command with a time limit.
Linux Commands  T,times,Shows accumulated user and system times for the shell and it’s child processes.
Linux Commands  T,tload,Shows a graph of the current system load average to the specified tty.
Linux Commands  T,tmpwatch,Recursively remove files and directories which haven’t been accessed for the specified period of time.
Linux Commands  T,top,Displays real-time view of processes running on the system.
Linux Commands  T,touch,Change file access and modification times.
Linux Commands  T,tput,"Modify terminal-dependent capabilities, color, etc."
Linux Commands  T,tr,"Translate, squeeze, or delete characters from standard input and display on standard output."
Linux Commands  T,tracepath,Traces path to a network host discovering MTU (Maximum Transmission Unit) along this path.
Linux Commands  T,traceroute,Traces the route taken by the packets to reach the network host.
Linux Commands  T,trap,Trap function responds to hardware signals. It defines and creates handlers to run when the shell receives signals.
Linux Commands  T,troff,The troff processor of the groff text formatting system.
Linux Commands  T,TRUE,Exit with a status code indicating success.
Linux Commands  T,tset,Initialize terminal.
Linux Commands  T,tsort,Perform topological sort.
Linux Commands  T,tty,Display the filename of the terminal connected to standard input.
