section,name,description
Linux Commands  T,tune2fs,Adjust tunable filesystem parameters on ext2/ext3/ext4 filesystems.
Linux Commands  T,tunelp,Set various parameters for the line printer devices.
Linux Commands  T,type,Write a description for a command type.
Linux Commands  U,ul,Underline text.
Linux Commands  U,ulimit,Get and set user limits for the calling process.
Linux Commands  U,umask,Set file mode creation mask.
Linux Commands  U,umount,Unmount specified file systems.
Linux Commands  U,unalias,Remove alias definitions for specified alias names.
Linux Commands  U,uname,Show system information.
Linux Commands  U,uncompress,Uncompress the files compressed with the compress command.
Linux Commands  U,unexpand,Convert spaces to tabs for a specified file.
Linux Commands  U,unicode_start,Put keyboard and console in Unicode mode.
Linux Commands  U,unicode_stop,Revert keyboard and console from Unicode mode.
Linux Commands  U,uniq,Report or omit repeating lines.
Linux Commands  U,units,Convert units from one scalar to another.
Linux Commands  U,unrar,Extract files from a RAR archive.
Linux Commands  U,unset,Remove variable or function names.
Linux Commands  U,unshar,Unpack shell archive scripts.
Linux Commands  U,until,Execute command until a given condition is true.
Linux Commands  U,uptime,Tell how long the system has been running.
Linux Commands  U,useradd,Create a new user or update default user information.
Linux Commands  U,userdel,Delete a user account and related files.
Linux Commands  U,usermod,Modify a user account.
Linux Commands  U,users,Show the list of active users on the machine.
Linux Commands  U,usleep,Suspend execution for microsecond intervals.
Linux Commands  U,uudecode,Decode a binary file.
Linux Commands  U,uuencode,Encode a binary file.
Linux Commands  U,uuidgen,Created a new UUID (Universally Unique Identifier) table.
Linux Commands  V,vdir,Same as ls -l -b. Verbosely list directory contents.
Linux Commands  V,vi,A text editor utility.
Linux Commands  V,vidmode,Set the video mode for a kernel image. Displays current mode value without arguments. Alternative: rdev -v
Linux Commands  V,vim,"Vi Improved, a text-based editor which is a successor to vi."
Linux Commands  V,vmstat,"Shows information about processes, memory, paging, block IO, traps, disks, and CPU activity."
Linux Commands  V,volname,"Returns volume name for a device formatted with an ISO-9660 filesystem. For example, CD-ROM."
Linux Commands  W,w,Show who is logged-on and what they’re doing.
Linux Commands  W,wait,Waits for a specified process ID(s) to terminate and returns the termination status.
Linux Commands  W,wall,Display a message on the terminals all the users who are currently logged-in.
Linux Commands  W,warnquota,Send mail to the users who’ve exceeded their disk quota soft limit.
Linux Commands  W,watch,Runs commands repeatedly until interrupted and shows their output and errors.
Linux Commands  W,wc,"Print newline, word, and byte count for each of the specified files."
Linux Commands  W,wget,A non-interactive file download utility.
Linux Commands  W,whatis,Display one line manual page descriptions.
Linux Commands  W,whereis,"Locate the binary, source, and man page files for a command."
Linux Commands  W,which,"For a given command, lists the pathnames for the files which would be executed when the command runs."
Linux Commands  W,while,Conditionally execute commands (while loop).
Linux Commands  W,who,Shows who is logged on.
Linux Commands  W,whoami,Displays the username tied to the current effective user ID.
Linux Commands  W,whois,Looks for an object in a WHOIS database
Linux Commands  W,write,Display a message on other user’s terminal.
Linux Commands  X,xargs,Runs a command using initial arguments and then reads remaining arguments from standard input.
Linux Commands  X,xdg-open,Used to open a file or URL in an application preferred by the user.
Linux Commands  X,xinetd,Extended internet services daemon. Works similar to inetd.
Linux Commands  X,xz,Compress/ Decompress .xz and .lzma files.
Linux Commands  Y,yacc,"Yet Another Compiler Compiler, a GNU Project parser generator."
Linux Commands  Y,yes,Repeatedly output a line with a specified string(s) until killed.
Linux Commands  Y,ypbind,A daemon that helps client processes to connect to an NIS server.
Linux Commands  Y,ypcat,Shows the NIS map (or database) for the specified MapName parameter.
Linux Commands  Y,ypinit,Sets up NIS maps on an NIS server.
Linux Commands  Y,ypmatch,Shows values for specified keys from an NIS map.
Linux Commands  Y,yppasswd,Change NIS login password.
Linux Commands  Y,yppasswdd,Acts as a server for the yppasswd command. Receives and executes requests.
Linux Commands  Y,yppoll,Shows the ID number or version of NIS map currently used on the NIS server.
Linux Commands  Y,yppush,Forces slave NIS servers to copy updated NIS maps.
Linux Commands  Y,ypserv,A daemon activated at system startup. It looks for information in local NIS maps.
Linux Commands  Y,ypset,Point a client (running ypbind) to a specifc server (running ypserv).
Linux Commands  Y,yptest,Calls various functions to check the configuration of NIS services.
Linux Commands  Y,ypwhich,Shows the hostname for NIS server or master server for a given map.
Linux Commands  Y,ypxfr,Transfers NIS server map from server to a local host.
Linux Commands  Z,zcat,Used to compress/uncompress files. Similar to gzip
Linux Commands  Z,zcmp,Compare compressed files.
Linux Commands  Z,zdiff,Compare compressed files line by line.
Linux Commands  Z,zdump,Displays time for the timezone mentioned.
Linux Commands  Z,zforce,Adds .gz extension to all gzipped files.
Linux Commands  Z,zgrep,Performs grep on compressed files.
Linux Commands  Z,zic,Creates time conversion information files using the specified input files.
Linux Commands  Z,zip,A file compression and packaging utility.
Linux Commands  Z,zless,Displays information of a compressed file (using less command) on the terminal one screen at a time.
Linux Commands  Z,zmore,Displays output of a compressed file (using more command) on the terminal one page at a time.
Linux Commands  Z,znew,Recompress .z files to .gz. files.
